{
  "schemaVersion": 1,
  "id": "FA-REV-CONF-COLLISION-LANGUAGE-1235-LATIN-LOWER",
  "kind": "translation",
  "status": "draft",
  "version": "0.1.0",
  "profile": "fa-ir-g1-reverse",
  "profileVersion": "0.1.0",
  "suite": "collision-language-cross-mode",
  "sourceForwardRuleIds": [
    "FA-G1-LATIN-MODE-002",
    "FA-G1-LATIN-018",
    "FA-G1-LATIN-044",
    "FA-G1-LETTER-012",
    "FA-G1-LATIN-MODE-003"
  ],
  "input": {
    "cells": [
      "25",
      "1235",
      "25"
    ],
    "unicodeBraille": "⠒⠗⠒"
  },
  "options": {},
  "expected": {
    "ok": true,
    "text": "r",
    "lossy": false,
    "diagnosticCodes": []
  },
  "notes": [
    "Active Latin span selects the lowercase Latin candidate for the shared Braille cell."
  ]
}
