{
  "schemaVersion": 1,
  "id": "FA-REV-CONF-COLLISION-NUMERIC-124-BASE",
  "kind": "translation",
  "status": "draft",
  "version": "0.1.0",
  "profile": "fa-ir-g1-reverse",
  "profileVersion": "0.1.0",
  "suite": "collision-numeric-base-persian",
  "sourceForwardRuleIds": [
    "FA-G1-DIGIT-ARABIC-INDIC-006",
    "FA-G1-DIGIT-ASCII-006",
    "FA-G1-DIGIT-PERSIAN-006",
    "FA-G1-LATIN-006",
    "FA-G1-LATIN-032",
    "FA-G1-LETTER-023"
  ],
  "input": {
    "cells": [
      "124"
    ],
    "unicodeBraille": "⠋"
  },
  "options": {},
  "expected": {
    "ok": true,
    "text": "ف",
    "lossy": false,
    "diagnosticCodes": []
  },
  "notes": [
    "Base Persian state selects the unique Persian letter when present; otherwise ambiguity remains."
  ]
}
