{
  "schemaVersion": 1,
  "id": "FA-REV-CONF-COLLISION-NUMERIC-15-LATIN-LOWER",
  "kind": "translation",
  "status": "draft",
  "version": "0.1.0",
  "profile": "fa-ir-g1-reverse",
  "profileVersion": "0.1.0",
  "suite": "collision-numeric-latin-mode",
  "sourceForwardRuleIds": [
    "FA-G1-LATIN-MODE-002",
    "FA-G1-DIGIT-ARABIC-INDIC-005",
    "FA-G1-DIGIT-ASCII-005",
    "FA-G1-DIGIT-PERSIAN-005",
    "FA-G1-LATIN-005",
    "FA-G1-LATIN-031",
    "FA-G1-LATIN-MODE-003"
  ],
  "input": {
    "cells": [
      "25",
      "15",
      "25"
    ],
    "unicodeBraille": "⠒⠑⠒"
  },
  "options": {},
  "expected": {
    "ok": true,
    "text": "e",
    "lossy": false,
    "diagnosticCodes": []
  },
  "notes": [
    "Latin span state resolves the shared cell to the lowercase Latin candidate."
  ]
}
