{
  "schemaVersion": 1,
  "id": "FA-REV-CONF-COLLISION-LANGUAGE-2345-LATIN-UPPER",
  "kind": "translation",
  "status": "draft",
  "version": "0.1.0",
  "profile": "fa-ir-g1-reverse",
  "profileVersion": "0.1.0",
  "suite": "collision-language-cross-mode",
  "sourceForwardRuleIds": [
    "FA-G1-LATIN-MODE-002",
    "FA-G1-LATIN-MODE-004",
    "FA-G1-LATIN-020",
    "FA-G1-LATIN-046",
    "FA-G1-LETTER-004",
    "FA-G1-LATIN-MODE-003"
  ],
  "input": {
    "cells": [
      "25",
      "6",
      "2345",
      "25"
    ],
    "unicodeBraille": "⠒⠠⠞⠒"
  },
  "options": {},
  "expected": {
    "ok": true,
    "text": "T",
    "lossy": false,
    "diagnosticCodes": []
  },
  "notes": [
    "Pending-capital state selects the uppercase Latin candidate inside an active Latin span."
  ]
}
