{
  "schemaVersion": 1,
  "id": "FA-REV-CONF-PAIRED-PARENS-001",
  "kind": "translation",
  "status": "draft",
  "version": "0.1.0",
  "profile": "fa-ir-g1-reverse",
  "profileVersion": "0.1.0",
  "suite": "paired-punctuation",
  "sourceForwardRuleIds": [
    "FA-G1-PUNC-SCALAR-019",
    "FA-G1-PUNC-SCALAR-020"
  ],
  "input": {
    "cells": [
      "2356",
      "2356"
    ],
    "unicodeBraille": "⠶⠶"
  },
  "options": {},
  "expected": {
    "ok": true,
    "text": "()",
    "lossy": false,
    "diagnosticCodes": []
  },
  "notes": [
    "The first same-cell delimiter opens and the second closes through parser position and delimiter-stack context."
  ]
}
