{
  "schemaVersion": 1,
  "id": "FA-REV-CONF-COLLISION-LANGUAGE-2345-BASE-STRICT",
  "kind": "translation",
  "status": "draft",
  "version": "0.1.0",
  "profile": "fa-ir-g1-reverse",
  "profileVersion": "0.1.0",
  "suite": "collision-language-cross-mode",
  "sourceForwardRuleIds": [
    "FA-G1-LATIN-020",
    "FA-G1-LATIN-046",
    "FA-G1-LETTER-004"
  ],
  "input": {
    "cells": [
      "2345"
    ],
    "unicodeBraille": "⠞"
  },
  "options": {
    "ambiguityPolicy": "error"
  },
  "expected": {
    "ok": true,
    "text": "ت",
    "lossy": false,
    "diagnosticCodes": []
  },
  "notes": [
    "Base Persian state selects the unique Persian-letter candidate before generic ambiguity handling."
  ]
}
